[
  {
    "id": "P-92",
    "title": "Record calling the pair's coverage side a corrective and its usage side distorted",
    "whatChanged": "The JJM pair puts jjm-tap-coverage on the coverage side and jjm-functionality on the usage side. This record says the opposite, so one of the two is the wrong way round and the view would present the honest metric as the headline.",
    "when": "2024-01",
    "affectsDomains": ["infrastructure"],
    "affectsSeries": ["jjm-functionality"],
    "correctiveSeries": ["jjm-tap-coverage"],
    "directionOfBias": "overstates-post-2014",
    "bridgeExists": false,
    "sources": [{ "name": "Fixture, not a real source", "url": "https://example.org/", "tier": "T1" }]
  }
]
